Korg,Grandstage,Modulation,Modulation Depth,Controls the vibrato effect applied to the sound,1,,0,127,,,,,0-based,Default: Modulation Wheel,0-127: Vibrato intensity
Korg,Grandstage,Volume,Expression,Adjusts the volume of the program,11,,0,127,,,,,0-based,"Controls volume for both KEYBOARDS and ENSEMBLE sections. Acts differently on organ programs, controlling volume before rotary speaker.",0-127: Expression amount
Korg,Grandstage,Volume,Volume,Adjusts the volume of the program,7,,0,127,,,,,0-based,"Controls volume for both KEYBOARDS and ENSEMBLE sections. Program volume is a combination of LEVEL knob value, CC#7 (Volume) and CC#11 (Expression).",0-127: Volume level
Korg,Grandstage,Panning,Panpot,Controls the stereo position of the sound,10,,0,127,,,,,Centered,"Controls panpot for both KEYBOARDS and ENSEMBLE sections. Can be assigned to foot pedal in system settings.",0: Full left; 64: Center; 127: Full right
Korg,Grandstage,Performance,Damper Pedal,Controls the sustain/damper effect,64,,0,127,,,,,0-based,"Default: Damper pedal (DS-1H). Half-damper effect supported with DS-1H. Can be toggled On/Off per section via EDIT menu.",0-63: Off; 64-127: On (values support half-damper with DS-1H)
Korg,Grandstage,Performance,SW1 Modulation,Controls the SW1 effect for each program,80,,0,127,,,,,0-based,"Default: SW1 button. For layer/split, only transmitted/received via global MIDI channel and only enabled for KEYBOARDS section.",0-63: Off; 64-127: On
Korg,Grandstage,Performance,SW2 Modulation,Controls the SW2 effect for each program,81,,0,127,,,,,0-based,"Default: SW2 button. For layer/split, only transmitted/received via global MIDI channel and only enabled for KEYBOARDS section.",0-63: Off; 64-127: On
Korg,Grandstage,Performance,Sostenuto,Controls the sostenuto effect,66,,0,127,,,,,0-based,"Can be assigned to foot switch in system settings.",0-63: Off; 64-127: On
Korg,Grandstage,Performance,Soft Pedal,Applies a soft pedal effect,67,,0,127,,,,,0-based,"Can be assigned to foot switch in system settings.",0-63: Off; 64-127: On
Korg,Grandstage,System,All Note Off,Turns off all notes on the specified channel,123,,0,127,,,,,0-based,"Reception only; cannot be transmitted. Notes are turned off naturally, allowing decay portion to be heard.",0-127: All notes off
Korg,Grandstage,System,All Sound Off,Forcibly stops all sound on the specified channel,120,,0,127,,,,,0-based,"Reception only; cannot be transmitted. Forcibly stops all sound, decay portion will not be heard. For emergency use only.",0-127: All sound off
Korg,Grandstage,System,Reset All Controllers,Resets all controller values to zero,121,,0,127,,,,,0-based,"Reception only; cannot be transmitted.",0-127: Reset controllers